{
  "cells": [
    {
      "execution_schema_version": 2,
      "fold_id": 0,
      "net_return": 0.0022740012705,
      "periodic_returns": [
        0.0,
        0.0,
        0.0,
        0.0,
        0.0,
        0.0,
        1.884244775e-05,
        3.499934052675484e-05,
        3.499811561578861e-05,
        3.4996890790558526e-05,
        3.49956660510556e-05,
        3.4994441397270816e-05,
        3.4993216829195185e-05,
        -7.998169679273075e-05,
        3.499479128960595e-05,
        3.499356669704291e-05,
        3.4992342190182595e-05,
        3.4991117769016006e-05,
        3.4989893433534145e-05,
        3.498866918372803e-05,
        3.498744501958865e-05,
        3.498622094110703e-05,
        3.4984996948274174e-05,
        3.498377304108109e-05,
        3.49825492195188e-05,
        3.4981325483578304e-05,
        -7.995451847600144e-05,
        3.4982898874085e-05,
        3.4981675113682056e-05,
        3.4980451438894486e-05,
        3.497922784971332e-05,
        3.497800434612957e-05,
        3.497678092813425e-05,
        3.497555759571839e-05,
        3.4974334348873e-05,
        3.49731111875891e-05,
        3.4971888111857724e-05,
        3.497066512166989e-05,
        3.496944221701663e-05,
        -7.99273586237462e-05,
        3.497101453870944e-05,
        3.496979160961864e-05,
        3.4968568766056e-05,
        3.496734600801256e-05,
        3.4966123335479325e-05,
        3.496490074844734e-05,
        3.4963678246907636e-05,
        3.496245583085125e-05,
        3.49612335002692e-05,
        3.496001125515254e-05,
        3.49587890954923e-05,
        3.49575670212795e-05,
        -7.990021721715478e-05,
        3.495913827524713e-05,
        3.4957916176621694e-05,
        3.495669416343732e-05,
        3.495547223568504e-05,
        3.4954250393355895e-05,
        3.495302863644093e-05,
        3.495180696493119e-05,
        3.4950585378817714e-05,
        3.494936387809156e-05,
        3.494814246274377e-05,
        3.494692113276539e-05,
        3.494569988814746e-05,
        -7.987309423744242e-05,
        3.4947270075477135e-05,
        3.4946048806471425e-05,
        3.494482762281979e-05,
        3.4943606524513265e-05,
        3.494238551154292e-05,
        3.494116458389981e-05,
        3.4939943741574985e-05,
        3.49387229845595e-05,
        3.493750231284442e-05,
        3.49362817264208e-05,
        3.4935061225279705e-05,
        3.493384080941219e-05,
        -7.98459896658499e-05,
        3.493540993118967e-05,
        3.493418949095919e-05,
        3.493296913599591e-05,
        3.49317488662909e-05,
        3.4930528681835214e-05,
        3.492930858261994e-05,
        3.4928088568636124e-05,
        3.492686863987484e-05,
        3.492564879632717e-05,
        3.4924429037984176e-05,
        3.4923209364836934e-05,
        3.492198977687652e-05,
        -7.981890348364345e-05,
        3.492355783418608e-05,
        3.4922338221887484e-05,
        3.492111869476934e-05,
        -1.979576887506852e-05
      ],
      "phase": "train",
      "result_fingerprint": "cc618f6de1761f5fb6218edf0f022f81e3549feb8885fa0febcc5f78ba06ef9a",
      "runtime_promotion_eligible": false,
      "status": "complete",
      "variant_index": 0
    },
    {
      "execution_schema_version": 2,
      "fold_id": 0,
      "net_return": 0.00209872117425,
      "periodic_returns": [
        0.0,
        0.0,
        0.0,
        0.0,
        0.0,
        0.0,
        0.0,
        0.0,
        0.0,
        0.0,
        0.0,
        1.85623515e-05,
        3.4999350329756905e-05,
        -7.999571524138174e-05,
        3.500092534216137e-05,
        3.4999700320263465e-05,
        3.4998475384113353e-05,
        3.499725053370204e-05,
        3.499602576902052e-05,
        3.4994801090059784e-05,
        3.499357649681085e-05,
        3.4992351989264714e-05,
        3.4991127567412374e-05,
        3.4989903231244836e-05,
        3.498867898075311e-05,
        3.49874548159282e-05,
        -7.996852739831113e-05,
        3.498902875786598e-05,
        3.498780456856576e-05,
        3.498658046492593e-05,
        3.49853564469375e-05,
        3.498413251459149e-05,
        3.4982908667878915e-05,
        3.498168490679077e-05,
        3.498046123131808e-05,
        3.4979237641451864e-05,
        3.497801413718313e-05,
        3.497679071850291e-05,
        3.497556738540221e-05,
        -7.994135802942184e-05,
        3.497714025796426e-05,
        3.497591690041318e-05,
        3.4974693628435214e-05,
        3.497347044202138e-05,
        3.4972247341162705e-05,
        3.497102432585021e-05,
        3.496980139607492e-05,
        3.496857855182786e-05,
        3.496735579310006e-05,
        3.4966133119882546e-05,
        3.4964910532166354e-05,
        3.496368802994251e-05,
        -7.99142071158904e-05,
        3.4965259834218304e-05,
        3.4964037307568994e-05,
        3.496281486640563e-05,
        3.496159251071924e-05,
        3.4960370240500866e-05,
        3.4959148055741544e-05,
        3.4957925956432315e-05,
        3.495670394256421e-05,
        3.495548201412827e-05,
        3.4954260171115545e-05,
        3.4953038413517066e-05,
        3.495181674132388e-05,
        -7.988707463891895e-05,
        3.495338747840141e-05,
        3.4952165781807634e-05,
        3.495094417061275e-05,
        3.494972264480781e-05,
        3.494850120438387e-05,
        3.494727984933196e-05,
        3.494605857964315e-05,
        3.494483739530848e-05,
        3.4943616296319e-05,
        3.494239528266576e-05,
        3.4941174354339834e-05,
        3.493995351133226e-05,
        -7.985996057973511e-05,
        3.494152318229804e-05,
        3.494030231491471e-05,
        3.493908153284335e-05,
        3.493786083607501e-05,
        3.4936640224600764e-05,
        3.493541969841166e-05,
        3.4934199257498774e-05,
        3.493297890185316e-05,
        3.493175863146588e-05,
        3.493053844632801e-05,
        3.492931834643061e-05,
        3.4928098331764736e-05,
        -7.983286491959195e-05,
        3.4929666937703805e-05,
        3.492844689868698e-05,
        3.492722694489532e-05,
        -1.9799231343886205e-05
      ],
      "phase": "train",
      "result_fingerprint": "db128210fb842b21bf9b39785814f9992dbc10e6db2051ef76371a4b41d92af8",
      "runtime_promotion_eligible": false,
      "status": "complete",
      "variant_index": 1
    },
    {
      "execution_schema_version": 2,
      "fold_id": 0,
      "net_return": 0.001863345045,
      "periodic_returns": [
        0.0,
        0.0,
        0.0,
        0.0,
        0.0,
        0.0,
        0.0,
        0.0,
        0.0,
        0.0,
        0.0,
        0.0,
        0.0,
        0.0,
        0.0,
        0.0,
        0.0,
        0.0,
        0.0,
        0.0,
        0.0,
        1.818622225e-05,
        3.499936349379689e-05,
        3.499813858122308e-05,
        3.4996913754385594e-05,
        3.4995689013275416e-05,
        -7.998734710373386e-05,
        3.499726369616251e-05,
        3.499603893055974e-05,
        3.499481425067785e-05,
        3.4993589656507854e-05,
        3.499236514804076e-05,
        3.499114072526755e-05,
        3.498991638817925e-05,
        3.498869213676685e-05,
        3.4987467971021366e-05,
        3.498624389093381e-05,
        3.498501989649518e-05,
        3.498379598769649e-05,
        -7.996016494749432e-05,
        3.4985369600452767e-05,
        3.4984145667186445e-05,
        3.4982921819553644e-05,
        3.4981698057545384e-05,
        3.4980474381152674e-05,
        3.497925079036653e-05,
        3.4978027285177965e-05,
        3.497680386557801e-05,
        3.497558053155767e-05,
        3.497435728310797e-05,
        3.497313412021995e-05,
        3.49719110428846e-05,
        -7.993300125964108e-05,
        3.497348358660055e-05,
        3.4972260484822504e-05,
        3.4971037468590724e-05,
        3.496981453789625e-05,
        3.4968591692730105e-05,
        3.4967368933083315e-05,
        3.4966146258946906e-05,
        3.496492367031192e-05,
        3.496370116716938e-05,
        3.496247874951032e-05,
        3.496125641732577e-05,
        3.496003417060677e-05,
        -7.990585602135855e-05,
        3.496160564637142e-05,
        3.4960383375234605e-05,
        3.495916118955694e-05,
        3.495793908932946e-05,
        3.495671707454321e-05,
        3.495549514518922e-05,
        3.4954273301258534e-05,
        3.49530515427422e-05,
        3.495182986963125e-05,
        3.495060828191674e-05,
        3.4949386779589714e-05,
        3.4948165362641215e-05,
        -7.987872921385668e-05,
        3.494973577154209e-05,
        3.494851433020064e-05,
        3.494729297423133e-05,
        3.49460717036252e-05,
        3.4944850518373316e-05,
        3.494362941846672e-05,
        3.494240840389647e-05,
        3.494118747465361e-05,
        3.493996663072921e-05,
        3.493874587211431e-05,
        3.493752519879999e-05,
        3.49363046107773e-05,
        -7.985162081837097e-05,
        3.493787395390047e-05,
        3.493665334150965e-05,
        3.493543281440408e-05,
        -1.9803882850668568e-05
      ],
      "phase": "train",
      "result_fingerprint": "619ec363bb4c206a5a6821cd4941b89195c5f6e3323bb304a01a4ece6de36446",
      "runtime_promotion_eligible": false,
      "status": "complete",
      "variant_index": 2
    },
    {
      "execution_schema_version": 2,
      "fold_id": 0,
      "net_return": 0.0,
      "periodic_returns": [
        0.0,
        0.0,
        0.0,
        0.0,
        0.0,
        0.0,
        0.0,
        0.0,
        0.0,
        0.0,
        0.0,
        0.0,
        0.0,
        0.0,
        0.0,
        0.0,
        0.0,
        0.0,
        0.0,
        0.0,
        0.0,
        0.0,
        0.0,
        0.0,
        0.0,
        0.0,
        0.0,
        0.0,
        0.0,
        0.0,
        0.0,
        0.0,
        0.0,
        0.0,
        0.0,
        0.0,
        0.0,
        0.0,